{
  "confirmed_building": {
    "display_name": "Davao City earthquake-affected building sample",
    "candidate_id": "davao-earthquake-affected-building-sample",
    "city": "Davao City",
    "country": "Philippines",
    "gate_1_status": "confirmed_by_user",
    "scope_note": "Sample fixture models a confirmed target named in an official post-earthquake tag/status source."
  },
  "locked_earthquake_lane": "post_earthquake_tag_status",
  "document_inventory": [
    {
      "item_id": "official-tag-source-1",
      "description": "Official LGU source reports red and yellow tag issuance for earthquake-affected buildings and defines tag effects.",
      "evidence_strength": "direct_authoritative_target_evidence",
      "source_curation_class": "official_record",
      "is_positive_evidence": true,
      "target_match_status": "exact_target_match",
      "source_url": "https://davaocity.gov.ph/local-government/davao-city-issues-red-yellow-tags-on-earthquake-affected-buildings/",
      "source_name": "Davao City Government"
    }
  ],
  "evidence_strength": "direct_authoritative_target_evidence",
  "source_curation_class": "official_record",
  "physical_condition_public_evidence": [
    {
      "item_id": "tag-effects-1",
      "description": "The official source describes use restrictions tied to red and yellow tags.",
      "evidence_strength": "direct_authoritative_target_evidence",
      "source_curation_class": "official_record",
      "is_positive_evidence": true,
      "target_match_status": "exact_target_match",
      "source_url": "https://davaocity.gov.ph/local-government/davao-city-issues-red-yellow-tags-on-earthquake-affected-buildings/",
      "source_name": "Davao City Government"
    }
  ],
  "unresolved_exceptions": [
    {
      "exception_id": "current-status-not-established",
      "description": "The fixture preserves that an older tag/status source does not by itself establish the latest condition.",
      "resolution_route": "Request latest tag/status or lifting records from the issuing office."
    }
  ],
  "manual_request_targets": [
    {
      "target": "Davao City Office of the Building Official",
      "request": "Ask for the latest tag/status and any follow-up inspection record for the confirmed target.",
      "reason": "A tag/status source must be dated and may need latest-status verification."
    }
  ],
  "overclaim_boundary": {
    "allowed_conclusion": "Official post-earthquake tag/status evidence was found and must be reported with date, target, issuing body, and unresolved latest-status exceptions.",
    "forbidden_conclusion_codes": [
      "permanent_condition",
      "earthquake_safe",
      "earthquake_unsafe",
      "cleared_without_source"
    ]
  },
  "query_log": [
    {
      "query": "site:davaocity.gov.ph earthquake red yellow tags buildings",
      "searched_surface": "official LGU web",
      "result_summary": "Official LGU post-earthquake tag/status source found.",
      "source_url": "https://davaocity.gov.ph/local-government/davao-city-issues-red-yellow-tags-on-earthquake-affected-buildings/"
    }
  ],
  "packet_result": {
    "status": "positive_evidence_found",
    "summary": "Official post-earthquake tag/status evidence was found; the packet preserves unresolved latest-status exceptions.",
    "answer_semantics": "status_answer_lane"
  }
}
